{
  "version": 2,
  "settings": {
    "host_key_policy": "accept_new",
    "connect_timeout_seconds": 10,
    "server_alive_interval_seconds": 15,
    "server_alive_count_max": 3,
    "tcp_keep_alive": true,
    "compression": false
  },
  "hosts": [
    {
      "id": "550e8400-e29b-41d4-a716-446655440000",
      "name": "development",
      "hostname": "ssh.example.invalid",
      "port": 22,
      "username": "developer",
      "auth": {
        "type": "ssh_agent"
      },
      "enabled": true
    }
  ],
  "tunnels": [
    {
      "id": "0b2c5a19-76b7-4d54-b2be-c32e703bd503",
      "name": "jupyter",
      "host_id": "550e8400-e29b-41d4-a716-446655440000",
      "type": "local",
      "local": { "host": "127.0.0.1", "port": 18888 },
      "remote": { "host": "127.0.0.1", "port": 8888 },
      "gateway_ports": false,
      "custom_options": [],
      "auto_start": false,
      "auto_reconnect": true,
      "auto_open_browser": false,
      "enabled": true
    }
  ]
}
